qid,query
5682911#0,خواننده سنتی در چه دستگاهی آواز می خواتد؟
5326439#0,دین مسیحیت در کجا بیشتر رواج دارد؟
1225615#0,چگونه ورزش به سلامت انسان کمک می کند؟
1581996#0,آش رشته چگونه تهیه می شور؟
5882571#0,رفاه  حال کودکان در گرو چیست؟
3688680#0,یونان در چه موقعیت جغرافیایی قرار دارد؟
360767#0,امپراطوری های بزرگ چگونه شکل گرفت؟
186110#0,پادشاهان گذشته چگونه حکومت میکردند؟
5622615#0,رابطه شعر و فرهنگ درچیست؟
4334823#0,کاربرد برنامه نویسی در کامپیوتر چیست؟
5552738#0,عملکرد مغز به چه چیزهایی بستگی دارد؟
4735147#0,چند فوتبالیست در یک تیم باهم بازی میکنند؟
3769425#0,چرا از موش در تحقیقات آزمایشگاهی استفاده می شود؟
4986060#0,اسامی مستعار در کجا استفاده میشود؟
2806820#0,کاربرد گرافیک در انیمیشن چیست؟
4939434#0,دیگ ذوب برای چه چیزی استفاده می شود؟
4352235#0,چه برنامه ای برای اجرای فایل ها استفاده می شود؟
958347#0,رودخانه هاچه تاثیری در آب و هوا دارند؟
5256854#0,کدام کشور مهد موسیقی است؟
2330308#0,شیشه در کجا کاربرد دارد؟
5921962#0,غمارت گلستاد در کجا قرار دارد؟
4382477#0,مدل های جدید خودرو در کجا به نمایش گذاشته میشوند؟
5740020#0,انتخابات ریاست جمهوری چه زمانی برگزار میشوند؟
3385349#0,خالق کتابهای کمیک کیست؟
4284225#0,جانداران به چند گروه دسته بندی میشوند؟
895627#0,چرا فشرده سازی کلمات در کامپیوتر اهمیت دترد؟
4757900#0,رودخانه سفیدرود چند ملر طول دارد؟
896299#0,درخت کاج در چه مناطقی بیشتر می روید؟
903512#0,چه چیزی باعث ثبات دمای محیط می شود؟
201549#0,باشگاه‌های فوتبال کدام کشور بهترین بازیکنان را دارد؟
39969#0,چه رشته دانشگاهی با معادن طبیعی سروکار دارد؟
1040246#0,گل سرخ در چه شرایطی رشد می کند؟
1793593#0,باکتری ها در چه مخیطی رشد می کنند؟
860819#0,روح الله موسوی خمینی که بود؟
3878416#0,تیم برتر فوتبال فرانسه چه نام دارد؟
2348098#0,اساس معماری نوین برگرفته هز چیست؟
363906#0,چرا فیلم کمدی در بین مردم از محبوبیت خاصی برخوردار است؟
1794096#0,روش ازدیاد گل شمعدانی چیست؟
384474#0,ساخت یک فیلم مستند چه مدت طول می کشد؟
30982#0,پیمان نامه آخال بین چه کشورهایی بسته شد؟
1300736#0,رونالدینو سابقه بازی در چند بازی ملی را در کارنامه خود دارد؟
4661104#0,از سنگها چه استفاده ای می شود؟
4307643#0,معنی کلمه حُبّ در عربی چیست؟
2382005#0,در داستان های کوتاه از چه ژانرهایی استفاده میشود؟
3187542#0,فیلم کمدی مارمولک را چه کسی کارگردانی کرده است؟
3737342#0,در ساخت ترانه از چه سبکهایی استفاده می شود؟
143811#0,در آمار و احتمالات چه عوامتی مورد بررسی قرار می گیرد؟
140324#0,جنگ داخلی افغانستان به چه علت روی داد؟
346327#0,ورزش والیبال در چند ست انجام می شود؟
1485291#0,پیامبر اسلام در چند سالگی به پیامبری اسلام منصوب شد؟
5643334#0,مایکروسافت په برنامه هایی را به بازار عرضه کرده است؟
902352#0,پرسپکتیو در هنر گرافیک چگونه نشاد داده میشود؟
3806138#0,وظیفه حافظه رام چیست؟
5184334#0,مجریان گات تلنت آمریکا چه کساتی هستند؟
50878#0,ولتاژ جریان برق در آمزیکای شمالی چقدر است؟
5909150#0,سلسله اشکانیان در چه قرنی می زیستند؟
858765#0,مشخصه  تانک های  جنگی چیست؟
1672385#0,طراحی فرش به سبک نوین از چه زمانی آغاز شد؟
2550219#0,در بیهوشی عمومی از چه موادی استفاده می شود؟
5444476#0,نیروی اصطکاک میان دو جسم چگونه اندازه گیری می شود؟
141836#0,شهر کازرون در کدام استان ایران واقع شده است؟
4753050#0,"نقش کلمه ""چیز"" در جمله چیست؟"
5323419#0,از منبع نور خورشیدی چه استفاده هایی می توان کرد؟
494478#0,شهر کردکوی در در کدام منطقه آب و هوایی قرار دارد؟
215402#0,"فیلم ایرانی ""سقوط یک فرشته"" ساخته کیست؟"
352161#0,رئیس قوه مجریه جمهوری اسلامی ایران چگونه تعیین می شود؟
224651#0,آبشار شاه کولاک در کدام شهر اصفهان قرار دارد؟
232142#0,حزب کمونیست کره شمالی از چه زمانی آغاز به کار کرده است ؟
1672634#0,رکود اقتصادی چه اثری بر دولت آمریکا گذاشت؟
195007#0,از چتر چه استفاده ای می شود؟
3642215#0,قدیمی‌ترین سنگ‌های قاره اروپا چغدر غدمت دارند؟
479365#0,شکیرا در چه سالی خوانندگی را آغاز کرد؟
2326230#0,سبک موسیقی موتسارت چه بود؟
3967261#0,سیلیکون در چه دمایی ذوب میشود؟
4888335#0,در کارآفرینی چه مواردی مورد توجه قرار می گیرد؟
2430308#0,چه کسی پایه گذار روزنامه ایران در ایران بود؟
317608#0,در زبان‌شناسی شناختی تشبیه به چه معناست؟
1095109#0,گل نرگس از چه خانواده ای از گیاهان است؟
2550058#0,کدام کشورها جمعیت مسیحیان آن بیشتر است؟
4970972#0,حمله به سفارت آمریکا در ایران در چه سالی اتفاق افتاد؟
5523776#0,یک تهیه کننده چه فاکتورهایی را در کارش مورد توجه قرار می دهد؟
803268#0,بریتنی اسپیرز در چه سالی اولین آهنگ خود را منتشر کرد؟
243850#0,نظریات مارکسیستی از چه عواملی بوجود آمدند؟
541198#0,سبک معماری دوره قاجار در چه زمینه ای بود؟
159608#0,فلسفه ابن سینا به چه مباحثی می پردازد؟
4826325#0,لباسهای پلی استرچند درصد پلاستک دارند؟
3489863#0,مادرنظام السلطنه که بود؟
2684482#0,شرایط اخذ بورسیه تحصیلی چیست؟
210602#0,زادگاه تکواندو چه کشوری است؟
5273856#0,استالین رهبر شوروی در چه سالی به قدرت رسید؟
64175#0,آسیاب آبی چگونه کار میکند؟
50395#0,زیر دریایی های جنگی چگونه هدف خود را نشانه گیری می کنند؟
5446321#0,ترانه سلطان قلبها از کیست؟
5908571#0,سن ازدواج در ایران چند سالگی است؟
5501339#0,چه مناطقی به زبان سانسکریت صحبت می کردند؟
1665175#0,قانون‌های مربوط به ازدواج در قانون اساسی در چه سالی بازبینی شد؟
1521302#0,نقاش دربار قاجار که بود؟
348780#0,روستای کندوان در کجا قرار دارد؟
5504386#0,فلانری اوکانر از چه سبکی در داستان هایش پیروی میکنی؟
5129460#0,ساختمان دانشکده هنردر چه سالی ساخته شد؟
4295277#0,چه شرکت هایی سازنده کشتی های باری هستند؟
793403#0,بازیهای ویدئویی با چه برنامه هایی ساخته می شوند؟
2564570#0,ورزش دوی سرعت در چه مسافتی انجام می شود؟
5335173#0,پیشنهاد لایحه از طرف چه کسانی صورت می گیرد؟
201888#0,قانون جاذبه تویط چه کسی کشف سد؟
3600875#0,دتنشگاه کنکودیا در رتبه چندم قرار دارد؟
4367501#0,درلباس خواب ازچه پارچه ای استفاده نی شود؟
2552893#0,شخصیت اصلی فیلم مرد عنکبوتی کیست؟
153409#0,حضرت عیسی در چه قرنی می زیست؟
5856547#0,برگزارکننده جایزه بین‌المللی اسکار کیست؟
3263739#0,پرده صماغ در کدام قسمت گوش قرار دارد؟
5720596#0,فیلمبرداری فیلم لاست جه سالی به پایان رسید؟
5236173#0,عملیات نظامی آمریکا علیه افغانستان در چه سالی پایان یافت؟
5344910#0,آلبوم موسیقی بی‌کلام باران عشق را چه کسی ساخته است؟
4710571#0,انگلیس چند تیم فوتبال دارد؟
4294846#0,توانایی فهمیدن زبان توسط چه قسمتی از مغز انجام می شود؟
253980#0,پل ورسک در کجا قرار دارد؟
5839060#0,تاریخ کانادا چند سال قدمت دارد؟
2344353#0,سریال کمدی زیر آسمان شهرازچه شبکه ای پخش می شد؟
3351929#0,کدامیک از هنرپیشه های ایرانی در هالیوود فعالیت دارند؟
237859#0,غزوه تبوک به رهبری چه کسی درگرفت؟
5815689#0,اولین آلبوم استودیویی بیلی آیلیش چه نام دارد؟
4572583#0,رئیس کنفدراسیون فوتبال آسیا چه نام دارد؟
326362#0,رئیس کنونی انجمن کلیمیان تهران چه کسی است؟
146775#0,مترجم کتابهای جبران خلیل جبران کیست؟
5743171#0,چه عاملی باعث لخته شدن خون در بدن می شود؟
3814055#0,چند نوع بیماری کروموزومی وجود دارد؟
4368379#0,سلسلهٔ طاهریان چگونه شکل گرفت؟
313107#0,تفاوت کار آر ان ای و دی ان ای در چیست؟
5356124#0,سریال خانه ما در چند قسمت ساخته شد؟
2213030#0,داکوتای جنوبی در کجا واقع سدت است؟
4351162#0,خرید درمزایده به چه صورت انجام می شود؟
5707139#0,سنگهای دگرگونی چه خصوصیتی دارند؟
1070001#0,منطقه حفاظت شده ورجین در کدام استان قرار دارد؟
4299975#0,چند گونه اسما و صفات الاهی وجود دارد؟
2433001#0,قدمت شهر شیراز چند سال است؟
110966#0,ریشه زبان کردی از چه زبانی است؟
795596#0,مکانهایی که برای ثبت در میراث جهانی اقدام می کنند چه خصوصیتی باید داشته باشند؟
498759#0,صنعت چاپ چوبی در چه دوره ای پیشرفت کرد؟
3704017#0,چه خوانندگانی با ریپابلیک رکوردزهمکاری داشته اند؟
3549590#0,سریال افسانه جومونگ در چند قسمت پخش شد؟
242203#0,جدال سیاسی روسیه و گرجستان بر سر چه بود؟
401207#0,گازهایی خروجی پالایشگاهها از چه گازهایی تشکیل شده اند؟
328673#0,قصر ابونصر در کدام استان قرار دارد؟
158154#0,سبک موسیقی سنتی در چه دستگاهی خوانده می شود؟
3249974#0,شبکه قرآن در چه سالی شروع با کار کرد؟
2076536#0,موسیقی هیپ هاپ چند سال فرمت دارد؟
1342285#0,فرودگاه بین‌المللی امام خمینی در چند کیلومتری تهران واقع شده است؟
3600330#0,چه عواملی باعث انجام خودکشی می شود؟
4373183#0,نورالدین زنگی در چه قرنی می زیست؟
1792626#0,با چه موادی هادی میگویند؟
3690228#0,برای ازبین بردن آفات هز چه سمی استفاده می شود؟
4771602#0,نارنجک تفنگی چه گازی هنگام شلیک تولید می کند؟
507254#0,امپراتوری روم  در چه سالی پایان یافت؟
2335519#0,کدام گونه پرندگان در خطر انقراض هستند؟
4820134#0,داخلی ترین لایه پوست چه نام دارد؟
308148#0,تشریح قلب چه کمکی به یادگیری دانشجویان می کند؟
3849475#0,زیست شناس در چه زمینه ای به فعالیت می پردازد؟
5381883#0,زمین بازی تنیس چند متر است؟
3896454#0,هورمون ها چه تاثیری بر گرایشات جنسی دارند؟
4295996#0,چشمه آب گرم لاریجان در کجه واقع شده است؟
5927575#0,کتاب قرآن چند آیه دارد؟
45887#0,مشتق در ریاضیات چگونه گرفته میشود؟
5474015#0,قانون اساسی در چه سالی نوشته شد؟
1566530#0,استان مرکزی چند روستا دارد؟
5532225#0,مصرف باتری‌های قابل شارژچقدر است؟
234564#0,رمان بامداد خمار اثر نیست؟
15503#0,رقص کردی نماد چیست؟
3513692#0,تاریج و فرهنگ روسیه چند سال  قدمت دارد؟
3673385#0,علم اقتصاد چه کمکی به پیشرفت جوامع می کند؟
3324119#0,دلیل شهرت حافظ شیرازی شاعر ایرانی چیست؟
430652#0,جنگ زمینی و هوایی ایران و عراق چند سال طول کشید؟
413511#0,راههای مقابله با خشونت چیست؟
5884890#0,پادشاهی بریتانیای کبیر از چه زمانی آغاز شده است؟
154297#0,عنکبوتیان در چه مناطقی بیشتر وجود دارند؟
5370664#0,چه کارتون هایی در استودیو انیمیشن والت دیزنی ساخته شده است؟
625413#0,تفاوت رشته روان درمانی و روانکاوی در چیست؟
5501063#0,ستاد فرمان اجرایی امام در چه سالی تاسیس شد؟
6591#0,شقایق فراهانی درکدام دانشگاه تحصیل کرده است؟
1771444#0,راههای درمان سرطان چیست؟
5304429#0,در مجسمه سازی از چه وسایلی استفاده می شود؟
754048#0,بنیانگدار امپراطوری رم چه کسی است؟
4984160#0,حزب کمونیست شوروی در چه سالی ایجاد شد؟
2057652#0,شاه اسماعیل صفوی در چه سالی به قدرت رسید؟
3976727#0,کتاب تاریخ تذکره الاولیا از کیست؟
3416050#0,طبقه بندی ماهیان بر چه اساسی است؟
5177414#0,برهان در فلسفه به چه معناست؟
238305#0,چند نوع ورزش آبی وجود دارد؟
1114160#0,اولین آلبوم محمد رضا شجریان در چه سالی منتشر شد؟
806578#0,انتقال گرما به سیال چگونه انجام می شود؟
5408572#0,شاه جیمز در چه قرنی می زیست؟
4786388#0,کدامیک از روش‌های آموزش زبان بازدهی بهتری داشته است؟
4581590#0,اعتصاب سراسری معلمان به چه علت سر گرفت؟
33692#0,چرا جن ها را نمی تواد با چشم انسانی دید؟
5631625#0,فرشتگان به چند دسته طبقه بندی می شوند؟
2073743#0,فیلم رومئو و ژولیت ساخته چه کسی است؟
4070471#0,دبیرستان البرز توسط چه کسی ساخته شد؟
427298#0,چند نوع حافظه رایانه‌ای وجود دارد؟
3190411#0,چه عواملی باعث خروج سرورها از دسترس می شود؟
956318#0,رساله‌ سیاسی اسپینوزا نوشته کیست؟
915754#0,مسجد جامع قم در چه سالی ساخته شد؟
750528#0,نخست‌وزیران ایران در دوره پهلوی که بود؟
890630#0,اشغال کرانه باختری و نوار غزه توسط اسرائیل چه تاثیری در خاورمیانه  دارد؟
1692144#0,در کتابخانه‌های مرکزی از چه متونی نگهداری می شود؟
1067815#0,هسته یونیکس در رایانه شامل چه مجموعه ای است؟
1602483#0,روستای ابیانه در کجا قرار دارد؟
3587340#0,فرآیند ته نشین شدن از ترکیب چه موادی بوجود می آید؟
1794505#0,قهوه در چه کشورهایی کشت می شود؟
2338025#0,زبان زرگری چگونه بوجو آمد؟
4524470#0,بحران مالی در آمریکا در چه سالی رخ داد؟
1889856#0,به موجوداتی که از دست و پا برای راه رفتن استفاده میکنند چه میگویند؟
1993974#0,کاربرد نرم‌افزارهای گرافیکی در چه زمینه ای است؟
1608333#0,روستای آبیک در چه موقعیت جغرافیایی واقع شده است؟
3696323#0,موزه پول ایران در کجا قرار دارد؟
5358974#0,از هواپیماها چه استفاده ای می شود؟
1796558#0,از بانک خون در چه مواردی استفاده می شود؟
657815#0,مقبره نادرشاه در کجا واقع شده است؟
5115966#0,ساز سنتی کمانچه جزو چه سازهایی است؟
4334856#0,زبان‌های برنامه‌نویسی در رایانه چه هستند؟
5508401#0,نمک ها از فرآیند چه واکنشی ایجاد می شوند؟
4058057#0,اف‌بی‌آی در چه زمینه ای فعالیت می کند؟
1554813#0,فلسفه به چند شاخه تقسیم می شود؟
1084447#0,قرارداد انحصار تنباکو و توتون میان دولت ایران و انگلیس در چه سالی بسته شد؟
4763171#0,قانون اساسی ایران در چه سالی اجرایی شد؟
4569583#0,اولین آلبوم گروه بمرانی در چه سالی منتشر شد؟
23096#0,بار الکتریکی مثبت  چه خصوصیاتی دارد؟
5465399#0,ترانه یکی مثل تو از چه خواننده ای است؟
3247608#0,در کره زمین چند قاره وجود دارد؟
4764710#0,معنی کلمه سکولاریسم چیست؟
5208432#0,هنرهای تجسمی شامل چه هنر هایی می شود؟
293179#0,قانون مدنی ایران در چه سالی نوشته شد؟
44610#0,روستای پنج سنگ در کجا واقع شده است؟
4639037#0,تیر اندازی در دانشگاه مونترال توسط چه کسی صورت گرفت؟
4091178#0,جنگ استقلال ترکیه در چه سالی رخ داد؟
5616186#0,در زبان کردی چند گویش وجود دارد؟
5097354#0,قطعنامه  میات ایران و آمریکا بر سر توافقات هسته ای در چه سالی نفض شد؟ٔ
2511870#0,قهوه‌خانه به چه مکانی گفته می شود؟
153616#0,صحیفه سجادیه از کیست؟
1356931#0,لیبرتی سیتی در کدام کشور واقع شده است؟
485681#0,روستای زرگر در کجا قرار دارد؟
4349361#0,پروتئین‌های بزرگ چه ترکیباتی دارند؟
643145#0,شرکت ایران خودرو در چه سالی تاسیس شد؟
4335582#0,کدام کشورها در مستعمره انگلیس بوده اند؟
4740811#0,آکادمی هنر سن پترزبورگ در چه سالی تاسیس شد؟
3525766#0,به کنده کاری روی چوب چه می گویند؟
69195#0,ریشه زبان آلمانی چیست؟
23875#0,مساحت مثلث چگونه محاسبه می شود؟
37784#0,امامزاده داوود در کجا قرار دارد؟
24752#0,ارتش اسکندر مقدونی به چه مناطقی حمله کرده اند؟
5443196#0,تعداد نوترونها در ساختار اتمی چگونه محاسبه می شود؟
3425134#0,سبک ناتورالیسم در هنر به چه سبکی می گویند؟
180519#0,مسجد جامع تبریز در چه سالی ساخته شد؟
4704045#0,فیلم های رنگی از چه سالی به بازار آمدند؟
1365131#0,فیلم های سه‌بعدی چگونه ساخته می شوند؟
623842#0,سانتیاگو برنابئو یسته در چه سالی رئیس باشگاه رئال مادرید بود؟
91167#0,چند جشن باستانی در ایران وجود دارد؟
490271#0,خط  میخی در چه سالی ابداع شد؟
5026972#0,معاهده ترکمنچای در چه سالی بسته شد؟
1586776#0,آران وبیدگل در کدام استان قرار دارد؟
4839850#0,چگونه زمان را  با توجه به افزایش تغییرات مدیریت کنیم؟
1840441#0,عوارض حاد بیماری آلزایمر چیست؟
3370493#0,در کدام سیارات نشانه هایی از حیات وجو دارد؟
470895#0,جنگ بین النهرین میان چه کشورهایی رخ داد؟
392124#0,نیروی زمینی ایالات متحده آمریکا توسط چه سازمانی هدایت می شود؟
4839819#0,رهبر حزب دموکرات کانادا کیست؟
242472#0,فروغ فرخزاد چند دفتر شعر دارد؟
5369545#0,دراستودیو باندای نامکو چه بازی هایی ظبط شده اند؟
5521139#0,برمه در چه سالی به مستعمره انگلیس در آمد؟
2430542#0,زبان بدن چگونه تفسیر می شود؟
4401344#0,روستای شکرآباد در کجا قرار دارد؟
506924#0,چه ماشینهایی در کشور ژاپن ساخته می شوند؟
784937#0,پادشاه سلسلهٔ آل مظفر در چه قرنی حکمرانی می کرد؟
35929#0,نام اصلی هایده چه بود؟
51005#0,سبزه میدان ازمحله های شهر تهرام در چه سالی ساخته شد؟
623642#0,فیلم آخرین امپراطوری محصول چه سالی است؟
5913365#0,شخصیت افسانه‌ای  ثور در کدام فرهنگ شکل گرفته است؟
4888989#0,قطب گردشگری جنوب ایران چه شهری است؟
8669#0,مرکز استان فارس چه نام دارد؟
1504176#0,ایل افشار در چه منطقه ای ساکن بودند؟
161712#0,نشانه عنصر سزیم چیست؟
1534954#0,تاریخ‌نگاری چند سال قدمت دارد؟
3709870#0,مجموعه آثار ارشمیدس توسط چه انتشاراتی چاپ شد؟
5601268#0,سازمان ملل چند ارگان وجود دارد؟
5052888#0,قلعه رودخان در چه استانی قرار دارد؟
316945#0,باشگاه فرهنگی ورزشی مس کرمان در چه سالی آغاز با کار کرد؟
3591346#0,مربی فعلی تیم ملی فوتبال ایران کیست؟
3510933#0,ارتفاع کوه دماوند چند متر است؟
5869227#0,خلافت عثمانی را چه کسی رهبری می کرد؟
281976#0,قطبیت اتم چگونه تشخیص داده می شود؟
1756901#0,حیطه کاری سازمان عفو بین‌الملل در چیست؟
5933338#0,نام فعلی قسطنطنیه چیست؟
2074311#0,بمب های هسته ای چگونه کار می کنند؟
3972463#0,در رنگ چوب از چه موادی استفاده می شود؟
312672#0,ماهنامه تجربه به مدیریت چه کسی منتشر می شود؟
216387#0,فیلادلفیا در کدام ایالت آمریکا قرار دارد؟
32097#0,آفرینش آدم در چند روز شکل گرفت؟
5180699#0,آهنگ تاکی تاکی سلنا گومز در چه رتبه ای قرار گرفته است؟
281012#0,پل سی و سه پل چند متر طول دارد؟
3857133#0,در چه دوره‌ای از تاریخ ایران جنبش مشروطه رخ داد؟
327628#0,جاده ابریشم از چه شهرهایی عبور میکند؟
1654485#0,رهبر کره جنوبی چه کسی است؟
145077#0,داده های کامپیوتری در چه قسمتی نگهداری میشوند؟
3264199#0,پادشاهان اساطیر روم چه کسانی بودند؟
284408#0,شدت امواج زلزله چگونه ثبت می شود؟
5281963#0,امامزاده صالح در کجا واقع شده است؟
298448#0,محصولات کشاورزی استان گیلان چیست؟
3509058#0,چه تکنیک هایی در بازی تنیس استفاده می شود؟
4349136#0,آنا پاولوا در چه سالی به رقص باله روی آورد؟
2656017#0,بازی والیبال در چند ست بازی می شود؟
955824#0,ارتفاع برج پیزا در ایتالیا چند متر است؟
2679613#0,عوارض داروی هماتینیک چیست؟
5813124#0,الفبای فارسی چند حرف است؟
2213132#0,زبان سی در کامپیوتر چه کاربردی دارد؟
4323295#0,محاصره عکا توسط چه کسی رهبری شد؟
3513590#0,بازی های اکشن چه تاثیری بر رفتار کودکان دارد؟
2446509#0,واحد اندازه‌گیری شمارش شتر چیست؟
4328243#0,صنعت نساجی ایران در چه رتبه ای در قیاس با سایر کشورها قرار دارد؟
2670#0,پادشاهی اشکانیان همزمان با چه دوره ای در اروپا بوده است؟
5093781#0,آثار باستانی شهر اصفهان کدامند؟
