qid,query
6718#0,شرقی ترین ایالت آمریکا چه نام دارد؟
3884871#0,فیلم شکلات به کارگردانی چه کسی به نمایش درآمد؟
2024297#0,نهضت بین‌المللی صلیب سرخ و هلال احمربه چه اهدافی شروع بکار کرد؟
2613586#0,سندرم اسپرگر چیست و چگونه  تشخیص داده می شود؟
2506167#0,نشانه های سندروم داون چیست؟
5188373#0,شاه سلطان حسین صفوی چندمین پادشاه سلسله صفوی است؟
737553#0,بهینگی پارتو دراقتصاد در چه جاهایی کاربرد دارد؟
3808080#0,غربزدگی از منظر فردید به چه معناست؟
5199483#0,موزه دل پرادو در کجا لرار دارد و در چه سالی گشایش یافت؟
424680#0,جمهوری اسلامی ایران در چه مواردی به نقظ حقوق بشر پرداخته است؟
442988#0,خودرو سدان محصول کدام کمپانی است؟
5909744#0,منطقه ۲ شهرداری تهران کدام نواحی تهران را در بر می گیرد؟
4655370#0,برج آزادی شهر تهران تماد چیست وبه دستور چه کسی ساخته شد؟
3967155#0,تابع هش چیست و چه کاربردی دارد؟
2347559#0,تفاوت سیستم‌عامل لینوکس و یونیکس در چیست؟
389224#0,عملیات ثامن‌الائمه به چه هدفی انجام شد؟
4707038#0,تاریخ طبری در چه قرنی و توسط چه کسی نوشته شده است؟
283797#0,واحد اندازه گیری حجم آب چیست؟
54629#0,بازی ویدئویی هالک برای چه پلتفرم هایی ساخته شده است؟
3467606#0,زبان اسپرانتو چگونه شکل گرفت؟
2072805#0,در چه شرایطی اقدام به بارودسازی ابرها می شود؟
222139#0,از شبکه های حسگر بی سیم چه استفاده ای می شود؟
3643930#0,شبکه یواس‌ای نتورک در چه سالی فعالیت خود را آغاز کرد؟
5873209#0,از جاسازی کلمه در آموزش زبان جدید چگونه استفاده می شود؟
202549#0,چه مواد شیمیایی در بنتونیت وجود دارد؟
5905353#0,توزیع نرمال چند متغیره چه کاربردی دارد؟
3834173#0,نخستین آلبوم اسنوپ داگ در چه سالی منتشر شد؟
4697652#0,ریچارد داوکینز در چه سالی و در کجا متولد شد؟
3274413#0,در روان درمانی از چه روشهایی برای درمان استفاده می شود؟
3246761#0,هولوگرام در چه جاهایی استفاده می شود؟
116667#0,فیزیک کوانتوم چه کاربردهایی دارد؟
1848371#0,سیستم‌عامل لینوکس چه کاربردی دارد؟
801771#0,در ایران به چند گویش صحبت می شود؟
35006#0,شهر اردکان در چند کیلومتری استان شیراز قرار دارد؟
4321759#0,پادشاهی اورشلیم در چه سالی خاتمه یافت؟
2061085#0,مهاجم تیم فوتبال منچستر چه نام دارد؟
5464668#0,یهودیان در طول جنگ جهانی دوم در کدام مناطق زندگی می کردند؟
385116#0,زلاتان ابراهیموویچ در کدام تیم فوتبال بازی میکند؟
54574#0,دانشکده سوربن در چه سالی به دانشگاه پاریس تغییر نام داد؟
2800526#0,سلمان خان در چه سالی بازیگری را شروع کرد؟
3414390#0,در مهندسی سازه به چه مواردی توجه می شود؟
1427743#0,سلسله جبال البرز در کجا قرار دارد؟
421606#0,عصر ویکتوریا به چه دوره ای گفته می شود؟
911470#0,کیسه صفرا در کدام قسمت بدن قرار  دارد؟
4615734#0,پتی جنکینز کارگردانی چه فیلمهایی را برعهده داشته است؟
718635#0,آزبست سفید دارای چه ترکیباتی است؟
2944491#0,از کشتی ها ی باربری در حمل چه کالاهایی استفاده میشود؟
93005#0,فیلم حس ششم به کارگردانی چه کسی به نمایش درآمد؟
5421508#0,چگونه از کرنوگراف و سرعت سنج در ساعت مچی استفاده می شود؟
3748074#0,استیضاح رئیس‌جمهور در چه شرایطی امکانپذیر است؟
5274329#0,دانشگاه ایلینوی در چه کشوری قرار دارد؟
3339064#0,مربی فعلی بسکتبال ایران چه نام دارد؟
5184642#0,شراب ازچه موادی تهیه می شود؟
349614#0,سازمان آزادیبخش فلسطین با چه هدفی تشکیل شد؟
208756#0,فیلم بدون دخترم هرگزرا چه کسی کارگردانی کرده است؟
908130#0,دوره پزشکی عمومی چند سال است؟
1468924#0,مقبره فتحعلی شاه قاجار در کجا قرار دارد؟
2550754#0,برج‌های دوقلو سازمان تجارت جهانی در نیویورک در چه تاریخی مورد حمله قرار گرفت؟
2383856#0,سلول‌های بنیادی در چه بافت هایی یافت می شوند؟
944533#0,امروزه قدرت خرید مردم در چه کالاهایی بیشتر است؟
4385487#0,روستای آبیک در کدام استان ایران قرار دارد؟
140819#0,شهر آستارا در کدام استان واقع شده است؟
157319#0,گل نرگس جزو کدام تیره از گلهاست و در کجا می روید؟
3660932#0,ردیابی ماهواره ها در فضا چگونه صورت می گیرد؟
3350551#0,سازمان مجاهدین خلق با رهبری چه کسی شکل گرفت؟
5876095#0,هورمون استروژن چه نقشی در بدن دارد؟
1783275#0,سردبیر نشریه نیویورک تایمز کیست؟
651276#0,اعضای گروه دث متال کنیبال کورپس چند نفر است؟
68649#0,شهرستان اراک در کدام استان ایران قرار دارد؟
5666611#0,کارگردان برنامه قلب قوی چه نام دارد؟
2454396#0,ورزش بسکتبال از کجا شکل گرفت؟
4763284#0,شرکت توسعه‌دهنده بازی‌های ویدئویی کریتیو اَسِمبلی توسط چه کسی تاسیس شد؟
182400#0,روستای کندوان در کدام استان قرار دارد؟
3516677#0,دانشگاه خواجه نصیرالدین طوسی در چه رتبه ای میان دانشگاههای ایران قرار دارد؟
2042847#0,الهه میترا نماد چیست؟
2530361#0,کدام عناصر نقطه ذوب بالایی دارند؟
668837#0,قلعه رودخان مربوط به چه دورانی است؟
5472876#0,اولین کتاب شعر فروغ فرخزاد چه نام دارد؟
5875231#0,جاده های بین شهری ایران چگونه مشخص شده اند؟
5552439#0,وظیفه دستگاه عصبی در جانداران چیست؟
3349880#0,نخستین پادشاه ارمنستان در چه سالی به قدرت رسید؟
5070276#0,نویسنده روس آنا اخماتووا  چند کتاب منتشر کرده است؟
5015360#0,مایکل شوماخر در چه سالی وارد مسابقات اتومبیلرانی شد؟
5513852#0,مراقبه و مدیتیشن چه شباهتی با هم دارند؟
35352#0,جمعیت مهاجران ایرانی در سایر کشورها چند نفر است؟
3347542#0,جشنواره فیلم فجر با ریاست چه کسی برگزار شد؟
4860501#0,علت وجود سیزده ستاره در پرچم ایالات مؤتلفه چیست؟
5168941#0,شنود الکترونیک اطلاعات چگونه امکانپذیر است؟
1518519#0,وضعیت حقوق زنان در ایران چگونه است؟
3773175#0,بازی هفت سنگ چگونه انجام می شود؟
90914#0,شرایط ارتداد چیست و چه حکمی دارد؟
5102082#0,چه عواملی ضامن رشد اقتصادی کشور است؟
3977839#0,دونالد ترامپچند دوره رئیس جمهور آمریکا بود؟
3698952#0,فیلم هری پاتر به کارگردانی چه کسی به نمایش درآمد؟
262626#0,مسجد الاقصی در کجا قرار دارد؟
5204978#0,داروهای ضد ویروس چه عوارضی دارند؟
223428#0,گروه موسیقی بلاندی در چه سالی تشکیل شد؟
5021296#0,غار علیصدر در کدام استان قرار دارد؟
4300673#0,نوشتن میثاق جامعه ملل  در چه سالی به اتمام رسید؟
2732924#0,چه عواملی در ترک سیگار موثر هستند
530304#0,اولین واکسن توسط چه کسی ساخته شد؟
2796712#0,آنتن‌های مخابرات ماهواره‌ای چگونه کار می کنند؟
107475#0,چه عواملی موجب اعتیاد می شو؟
670591#0,برج العرب در چه سالی و توسط چه کسی ساخته شده است؟
3238427#0,موهنجودارو در کجا واقع شده است؟
4721774#0,امپراتوری دودمان هان چگونه پایان یافت؟
3925493#0,چگونه از هوش مصنوعی برای ساخت بازی استفاده می شود؟
1654782#0,در چه شرایطی قانون را باطل اعلام می کنند؟
5505520#0,چه عواملی کوجب پیدایش نخبه‌سالاری می شود؟
5553568#0,چه عواملی بر روابط کشورها تاثیر میگذارد؟
638927#0,شهر رشت در کدام ناحیه آب و هوایی قرار دارد؟
531624#0,سوپ جو از چه موادی تهیه می شود؟
4414092#0,جمهوری اسلامی ایران در چه سالی تاسیس گردید؟
13118#0,دلایل افت جریان الکتریکی چیست؟
1695746#0,قدیمی ترین مناطق تاریخی استان تهران را نام ببرید؟
712575#0,وظیفه سازمان مهاجرت و پناهندگی کانادا چیست؟
1073931#0,سفرنامه ناصرخسرو اثر کیست؟
4380133#0,محمدعلی ندوشن نویسنده و پژوهشگر نامدار ایرانی در چه سالی متولد شد؟
3719200#0,رقبای اصلی مایکروسافت در جهان چه شرکت هایی هستند؟
4397589#0,نخستین دوره انتخابات ریاست جمهوری ایران در چه سالی انجام شد؟
4940340#0,پارک رودخانه فریزر در کدام استان کانادا واقع شده است؟
5284546#0,در چه صورت مشتركين صندوق بازنشستگي شهرداريها ازحقوق بازنشستگی بهره مند میشوند؟
1758513#0,دین بر چه اساسی پایه گذاری شده است؟
4054682#0,کمال الملک در دوره چه پادشاهی می زیست؟
5528775#0,باشگاه فوتبال بارسلونا در کدام شهر مستقر است؟
3242261#0,راه های ساده برای از بین بردن الکتریسیته موچیست؟
5908287#0,چند درصد از مصرف انرژی کل جهان از سوخت‌های فسیلی تأمین شده است؟
185575#0,طول هواپیماهای مسافربری ایرباس چقدر میباشد؟
476211#0,کارگردان فیلم پرتقال خونی کیست؟
1513609#0,تیراندازی اسکیت چیست؟
4570281#0,اهداف اتحادیه اقتصادی اروپا که در توافقنامه رم آمده‌است چیست؟
3591589#0,پادشاه انگلستان در جنگ جهانی اول چه کسی بود؟
718755#0,چگونه درجه سختی مجموعه کانی های خود را تعیین کنیم؟
5383986#0,نام یکی از محبوب‌ترین بازیهای ویدیویی حال حاضر دنیا چیست؟
46433#0,کتاب دین مسیحیت چه نام دارد؟
5451134#0,مردم اهواز به چه گویشی صحبت میکنند؟
89731#0,رشته گرافیک در کدام دانشگاه دولتی تدریس می شود؟
13676#0,زبان فرانسه چقدر قدمت دارد؟
5338225#0,بزرگ‌ترین کتابخانهٔ آمریکا در کجا داقع شده است؟
484478#0,جمعیت شهرستان لار چقدر است؟
450132#0,صاحب امتیاز و مدیر مسئول مجله خانواده کیست؟
3989288#0,بهترین استودیو برای ظبط صدا در مونترال چه نام دارد؟
2543613#0,مگان فاکس در چه فیلم هایی بازی کرده است؟
658107#0,دوره اشکانیان چه آثاری از خود به جا گذاشته اند؟
5514361#0,حساب پس‌اندازقرض الحسنه چه مزایایی دارد؟
4343706#0,کاربرد مدلسازی عامل بنیان چیست؟
1093563#0,روستای ابیانه در چند کیلومتری کاشان قرار دارد؟
3380401#0,هدف از نسل کشی آشوریان چه بود؟
5302873#0,اشیا بالقوه خطرناک در مجاورت سیاره زمین چگونه ردیابی می شوند؟
51393#0,مگادث چند آلبوم در بازار موسیقی دارد؟
499936#0,اولین پادشاه پادوسبانیان چه نام داشت؟
4769571#0,از چه راه هایی برای مقابله به آفات کشاورزی استفاده می شود؟
1515379#0,قلمرو پادشاهی ماننا در کجا بود؟
89028#0,اصحاب کهف چند سال به خواب رفتند؟
756814#0,جریان شکافنده چگونه تشخیص داده می شوند؟
5876755#0,اشعار فروغ فرخزاد در چه سبکی سروده شده اند؟
50049#0,مرکز شهر سیستان و بلوچستان کجاست؟
4839560#0,امواج مغزی با کمک چه دستگاهی ثبت می شوند؟
2053271#0,سعید معروف در چه تیمهایی بازی کرده است؟
5522450#0,اتوبوس‌های هیبرید چگونه کار می کنند؟
5528386#0,چه تغییرات فیزیولوژیکی در بدن مادرپس از زایمان رخ می دهد؟
939381#0,کتاب سه شاهزاده سرندیپ در چه سالی منتشر شد؟
296252#0,روستای سیدان در چند کیلومتری شهرستان بیجار قرار دارد؟
21182#0,کلیساهای کاتولیک رومی در چه قرنی تاسیس شد؟
5912006#0,رنگ تیره خون نشانگر چیست؟
59266#0,شهر بم در چه دوره ای ساخته شده است؟
15085#0,فردریک بِگبِدِر چند رمان نوشته است؟
5596568#0,فرهنگ کنسل چه عواقبی دارد؟
2542457#0,از چتر چه استفاده ای می شود؟
1887065#0,یوگایلا چه مدت بر لیتوانی فرمان راند؟
167023#0,انواع گونه های شتر کدامند و در کجا زندگی می کنند؟
1059233#0,بنیانگذار برند زارا کیست؟
1132753#0,شبکه خصوصی مجازی چیست و چه کاربردی دارد؟
299312#0,نرماله کردن فولاد چه کاربردی دارد؟
766150#0,نشریه آلخاص از چه تاریخی آغاز به کار کرده است؟
1829546#0,در مهندسی مکانیک از چه نرم افزارهایی استفاده می شود؟
3721392#0,فیلم راز به کارگردانی چه کسی به نمایش درآمد؟
122697#0,کتاب مصور مردگان متحرک در چه سالی منتشر شد؟
5889951#0,بازیگران فیلم حس ششم چه کسانی هستند؟
5369477#0,چرا ژاپن در قرن هفدهم قرنطینه شد؟
158806#0,عدد اتمی عنصر شیمیایی نئون کیست؟
2362338#0,نام آلبومی که ترانه سگ سیاه در آن است چه بود؟
251835#0,روستای زرگر در کجا واقع شده است؟
5406636#0,اتحادیهٔ ملی بسکتبالدر چه سالی تاسیس شد؟
1040333#0,آویشن کوهی جزو کدام گونه گیاهان است؟
5870565#0,کدام کشور ها در آسیای استوایی قرار دارند؟
5314567#0,دوران امپراطوری چین در چه سالی به پایان رسید؟
5345297#0,دبیر عامل فعلی جشنواره جهانی فیلم تهران چه کسی است؟
250664#0,در اساطیر یونانی هرکول کیست و چه شخصیتی دارد؟
5923700#0,دب اکبر چند سال نوری از زمین فاصله دارد؟
389546#0,سیستم‌عامل میکروتیک چه کاربردی دارد؟
1779048#0,میرعماد حسنی قزوینی در چه تاریخی متولد شد؟
4022616#0,کاربرد سامانهٔ دفاع فعال تروفی چیست؟
3876167#0,چه عواملی موجب ارتقای سلامت فردی می شود؟
539002#0,موسسه فناوری ماساچوست از چه سالی فعالیت خود را آغاز کرده است؟
206412#0,حمام فین در کدام شهر استان کاشان قرار دارد؟
3890832#0,محاصره لنینگراد در چه تاریخی اتفاق افتاد؟
5374291#0,عایشه صفت رضا آلپار رئیس کدام دانشگاه در ترکیه بود؟
8670#0,شهر تکاب در کدام استان ایران قرار دارد؟
348241#0,مساحت جزیره کیش در جنوب ایران چقدر است؟
4731493#0,بازیگران فیلم جوکر چه کسانی هستند؟
449266#0,سبک بازی مرد عنکبوتی چیست؟
1272553#0,داستان فیلم دزد عروسکها چیست؟
2048192#0,فیزیک کوانتوم با فیزیک هسته ای چه تفاوت و شباهت هایی دارد؟
150008#0,مساحت کاخ سلطنت‌آباد چند متر مربع است؟
1450105#0,فرودگاه مهرآباد در چه سالی و توسط چه کسی ساخته شد؟
5746487#0,قوانین ورزش کشتی کج چیست؟
2450621#0,مسعود صباغان در کجا متولد شد؟
2396722#0,تاکنون چند ماهواره به مدار زمین فرستاده شده است؟
5896543#0,دودمان هوهن‌تسولرن چه کسانی بودند و در کجا ساکن شدند؟
5407183#0,کوسه ها به چند گونه تقسیم می شوند؟
3226854#0,ذخیره گرما یا سرما چگونه انجام می شود
1105875#0,نقش خاندان دولتشاهی درتوسعه شهری کرمانشاه چه بود؟
1827900#0,گاورنر یا فرماندار چه کاربردی در صنعت دارد؟
259029#0,قانون حمایت خانواده در چه سالی بازبینی شد؟
3251266#0,کارگردان فیلم تند و سریع چه نام دارد؟
4270383#0,تفاوت اصلی سامورایی و نینجا در چیست؟
5415084#0,مجموعه تلویزیونی اینترنتی قورباغه به کارگردانی چه کسی منتشر شد؟
522842#0,درکاروان ایران در بازی‌های آسیایی 2018 چند ورزشکار حضور داشتند؟
205435#0,کدام رگ وظیفه رساندن خون تصفیه شدهبه اندانها را دارد؟
3225154#0,وظایف کنگره ایالات متحده آمریکا چیست؟
2531943#0,عناصر مشخص معماری دوره ساسانیان چیست؟
4793350#0,در جنگ جهانی اول متحدین و متفقین چه کشورهایی بودند ؟
233824#0,چه کشورهایی به زبان اسپانیایی صحبت می کنند؟
4056677#0,سازند گدوان در چه منطقه ای قرار دارد؟
653510#0,سنگ‌نبشته‌های هخامنشی با چه خطی نوشته شدند؟
1884992#0,نمایندهٔ دورهٔ دهم مجلس شورای اسلامی از حوزهٔ انتخابیهٔ تهران چه کسی است؟
939226#0,سنگ نگاره تیمره مربوط به چه دورانی است؟
3638782#0,کمپانی کلتکس در چه سالی تاسیس شد؟
52993#0,عامل اصلی تب مالت چیست؟
1571046#0,روستای قزلعلی در کدام استان ایران قرار دارد؟
5150390#0,شخصیت داستانی شازده کوچولو نماد چیست؟
2556137#0,انجمن ماکس پلانک در چه زمینه ای فعالیت دارد؟
1460034#0,بازی سنتی هفت سنگ چگونه انجام می شود؟
1568708#0,روستای ابیانه در چند کیلومتری کاشان قرار دارد؟
4298946#0,روزنامه حبل‌المتین در چه سالی تاسیس شد؟
355317#0,اثرات رطوبت هوا بر روی انسان چیست؟
535349#0,اِن-دی‌متیل‌تریپتامین از چه ترکیباتی ساخته شده است؟
5752870#0,حالیل سزایی یا در چند فیلم بازی کرده است؟
4872066#0,حمله پولواما در چه تاریخی رخ داد؟
930489#0,مارگارت سنجر در چه سالی متولد شد؟
146113#0,دانشگاه مکگیل در چه رتبه ای در میان دانشگاه های جهان قرار دارد؟
4296426#0,شخصیت خیالی هرمود از چه اساطیری گرفته شده است؟
249909#0,خرس قهوه‌ای در چه مناطقی زندگی می کند؟
630577#0,باقر صحرارودیدر چه سالی فعالیت هنری خود را آغاز کرد؟
759590#0,دومین قله مرتفع جهان چه نام دارد؟
389947#0,تپه‌های باستانی سیلک در کجا واقع شده است؟
5342438#0,ترانه بامن برقص از جانی رید توسط چه کمپانی منتشر شد؟
437395#0,پیمان لوزان میان چه کشورهایی بسته شد؟
5267845#0,نبرد برمه در چه سالی و میان چه کشورهایی رخ داد؟
4350528#0,مدل معروف ویکتوریا سیکرت چه نام دارد؟
1597515#0,روستای زرین آباد در کدام استاد ایران واقع شده است؟
30934#0,صدراعظم فعلی آلمان چه نام دارد؟
630631#0,سرود ملی ایران در دوره پهلوی سروده کیست؟
3594574#0,با چه وسیله ای گوش سوراخ می کنند؟
234972#0,تفاوت کمونیسم و سوسیالیسم چیست؟
27874#0,سندروم موزائیسم تریزومی چیست و چگونه تشخیص داده می شود؟
5412623#0,ادم ریوی چگونه درمان می شود؟
182966#0,بخش درونی گوش از چه اجزایی تشکیل شده است؟
2302832#0,کفشدوزکها به چند دسته تقسیم می شوند؟
5879644#0,پتی موری کیست وچه نقشی در سنای آمریکا دارد؟
5883570#0,کارگردان فیلم علاءالدین و شاه دزدان کیست؟
5720793#0,منبع سوخت موشک ها از چیست؟
3585292#0,شرکت یونایتد ایرکرفت کورپوریشن درچه سالی تاسیس شد؟
2319845#0,برای ویرایش متن از چه برنامه هایی می توان استفاده کرد؟
4911779#0,پادشاهی پنتوس بر چه مناطقی حکمرانی میکردند؟
647283#0,ابیانه در چند کیلومتری کاشان قرار دارد؟
1853296#0,تجزیه و تحلیل اطلاعات چیست و چه فرآیندی دارد؟
3400#0,ورزش اسکیت در چه سالی اختراع شد؟
485867#0,شیببر از جفت‌گیری چه حیواناتی بوجود میآید؟
2607419#0,از احمد فواد نجم چند آهنگ بجا مانده است؟
208146#0,تیتان‌ها در اسطوره‌های یونان کیستند؟
3493704#0,ورزشهای رزمی به چند دسته تقسیم می شوند؟
4286914#0,چطور در شرایط بحرانی درست فکر کنیم؟
145473#0,تاثیرات کمبود خواب بر بدن چیست؟
3324090#0,روستای میمند در کدام استان قرار دارد؟
1225429#0,سازهای معمول در موسیقی هاوس چیست؟
5730679#0,نظریه شش درجه جدایی توسط چه کسی بیان شد؟
2396349#0,تفاوت پکتین با ژلاتین در چیست؟
2502362#0,فیلم اسلشر آمریکایی هات فازمحصول چه سالی است؟
2145190#0,وزارت جنگ در دوره پهلوی به چه نامی در جمهوری اسلامی تغییر کرد؟
633051#0,تب برفکی چگونه درمان می شود؟
368028#0,اریتم گرهی چگونه درمان می شود؟
5107298#0,معایب و مزایای توربین گازی چیست؟
5789179#0,چند نوع حدیث متواتر داریم؟.
2437981#0,انجمن سلطنتی در چه سالی و توسط چه کسی بنیانگذاری شد؟
3272167#0,هواپیمای ترابری نظامی لاکهید سی-۱۳۰ هرکولس توسط چه کمپانی ساخته شد؟
3847209#0,نبرد نرماندی میان چه کشورهایی درگرفت؟
2787714#0,فیلم بن هور به کارگردانی چه کسی به نمایش درآمد؟
4860944#0,کنوانسیون بین‌المللی منع جنگ‌افزارهای شیمیایی در چه سالی به امضا رسید؟
112610#0,نبرد بزرگ سالامیس میان چه پادشاهانی رخ داد؟
5328422#0,معدن مس ایران در کدام استان قرار دارد؟
15462#0,قبایل بختیاری در کدام مناطق ساکن هستند؟
3478040#0,الکترودینامیک کوانتومی چیست و چه کاربردی دارد؟
3410765#0,دانشگاه پنسیلوانیا در چه رتبه ای میان دانشگاههای دنیا قرار دارد؟
4069509#0,قوانین بازی بدمینتون چیست؟
340756#0,شراب انگور چگونه درست می شود؟
